year,film,person,is_winner,raw_text,source_url
2046,Our Time Will Come,"Ann Hui, Roger Lee & Stephen Lam",True,"2018 (37th) | Our Time Will Come | Ann Hui, Roger Lee & Stephen Lam | Bona Film Group , Class Limited, Distribution Workshop & Entertainment Team Media Group | [ 37 ]",https://en.wikipedia.org/wiki/Hong_Kong_Film_Award_for_Best_Film
2046,"Peter Chan, Jojo Hui","Universe Entertainment, Infinitus Entertainment, Bona Film Group",False,"Shock Wave | Peter Chan, Jojo Hui | Universe Entertainment, Infinitus Entertainment, Bona Film Group",https://en.wikipedia.org/wiki/Hong_Kong_Film_Award_for_Best_Film
2046,Patricia Cheng,"Beijing Harirun Pictures, Dream Creek Productions",False,"Love Education | Patricia Cheng | Beijing Harirun Pictures, Dream Creek Productions",https://en.wikipedia.org/wiki/Hong_Kong_Film_Award_for_Best_Film
2046,"Wong Jing, Donnie Yen, Andy Lau & Connie Wong","Mega-Vision Project Workshop, Bona Film Group Company, Infinitus Entertainment & Super Bullet",False,"Chasing the Dragon | Wong Jing, Donnie Yen, Andy Lau & Connie Wong | Mega-Vision Project Workshop, Bona Film Group Company, Infinitus Entertainment & Super Bullet",https://en.wikipedia.org/wiki/Hong_Kong_Film_Award_for_Best_Film
2046,"Cheang Pou-soi , Paco Wong, Ren Yue, Stanley Tong & Yang Guang","Sun Entertainment Film Group, Bona Film Group Company, Alibaba Pictures, Sunny Side Up Limited & Shanghai PMF Media YL Entertainment and Spors",False,"Paradox | Cheang Pou-soi , Paco Wong, Ren Yue, Stanley Tong & Yang Guang | Sun Entertainment Film Group, Bona Film Group Company, Alibaba Pictures, Sunny Side Up (Never) Limited & Shanghai PMF Media YL Entertainment and Spors (YLES)",https://en.wikipedia.org/wiki/Hong_Kong_Film_Award_for_Best_Film
2046,Project Gutenberg,Ronald Wong,True,"2019 (38th) | Project Gutenberg | Ronald Wong | Pop Movies, Emperor Motion Pictures, Bona Film Group &Two Sixty Six Productions | [ 38 ]",https://en.wikipedia.org/wiki/Hong_Kong_Film_Award_for_Best_Film
2046,"Fruit Chan, Doris Yang",,False,"Three Husbands | Fruit Chan, Doris Yang | ",https://en.wikipedia.org/wiki/Hong_Kong_Film_Award_for_Best_Film
2046,Candy Leung,"Bona Film Group, Emperor Motion Pictures, Film Fireworks Production & Star Dream Studio Media",False,"Operation Red Sea | Candy Leung | Bona Film Group, Emperor Motion Pictures, Film Fireworks Production & Star Dream Studio Media",https://en.wikipedia.org/wiki/Hong_Kong_Film_Award_for_Best_Film
2046,Fruit Chan,Golden Scene Company Limited,False,Still Human | Fruit Chan | Golden Scene Company Limited,https://en.wikipedia.org/wiki/Hong_Kong_Film_Award_for_Best_Film
2046,"Joe Ma, Jacqueline Liu Yuen-Hung",One Cool Film Production Limited,False,"Men on the Dragon | Joe Ma, Jacqueline Liu Yuen-Hung | One Cool Film Production Limited",https://en.wikipedia.org/wiki/Hong_Kong_Film_Award_for_Best_Film
2046,Better Days,Jojo Hui,True,2020 (39th) | Better Days | Jojo Hui | Henan Film Group China Wit Media Tianijn Xiron Entertainment We Pictures Shooting Pictures | [ 39 ],https://en.wikipedia.org/wiki/Hong_Kong_Film_Award_for_Best_Film
2046,"Michael J. Werner , Teresa Kwong, Sandy Yip, Chowee Leow",New Voice Film Productions,False,"Suk Suk | Michael J. Werner , Teresa Kwong, Sandy Yip, Chowee Leow | New Voice Film Productions",https://en.wikipedia.org/wiki/Hong_Kong_Film_Award_for_Best_Film
2046,"Ann Hui , Julia Chu",,False,"Fagara | Ann Hui , Julia Chu | ",https://en.wikipedia.org/wiki/Hong_Kong_Film_Award_for_Best_Film
2046,Soi Cheang,,False,I'm Livin' It | Soi Cheang | ,https://en.wikipedia.org/wiki/Hong_Kong_Film_Award_for_Best_Film
2046,"Stephen Chow , Y. Y. Kong",,False,"The New King of Comedy | Stephen Chow , Y. Y. Kong | ",https://en.wikipedia.org/wiki/Hong_Kong_Film_Award_for_Best_Film
2046,Raging Fire,"Benny Chan , Donnie Yen",True,"2022 (40th) | Raging Fire | Benny Chan , Donnie Yen | Emperor Film Production Company | [ 40 ]",https://en.wikipedia.org/wiki/Hong_Kong_Film_Award_for_Best_Film
2046,"Bill Kong , Ivy Ho, Tang Wai-but",Edko Films,False,"Anita | Bill Kong , Ivy Ho, Tang Wai-but | Edko Films",https://en.wikipedia.org/wiki/Hong_Kong_Film_Award_for_Best_Film
2046,"Wilson Yip , Paco Wong",Sun Entertainment Culture,False,"Limbo | Wilson Yip , Paco Wong | Sun Entertainment Culture",https://en.wikipedia.org/wiki/Hong_Kong_Film_Award_for_Best_Film
2046,Sandra Ng,,False,Zero to Hero | Sandra Ng | ,https://en.wikipedia.org/wiki/Hong_Kong_Film_Award_for_Best_Film
2046,Mani Man,mm2 Entertainment,False,Drifting | Mani Man | mm2 Entertainment,https://en.wikipedia.org/wiki/Hong_Kong_Film_Award_for_Best_Film
2046,To My Nineteen Year Old Self,Eunice Wong,True,2023 (41st) | To My Nineteen Year Old Self | Eunice Wong | Ying Wa Girls' School | [ 41 ],https://en.wikipedia.org/wiki/Hong_Kong_Film_Award_for_Best_Film
2046,Philip Yung,Golden Scene Mei Ah Entertainment,False,The Sparring Partner | Philip Yung | Golden Scene Mei Ah Entertainment,https://en.wikipedia.org/wiki/Hong_Kong_Film_Award_for_Best_Film
2046,"Louis Koo , Tang Wai But",One Cool Film Production Media Asia Film Production World Universe Culture iQiyi Motion Pictures Beijing Unimedia Television Culture Tianjin Maoyan Weying Media Shenzhen Film Studio Shanghai CMC Pictures Beijing Gutian Film and Television Production Shenzhen Film & Television Co. Beijing Le Art Media & Culture Co. Lok Tin Films Production,False,"Warriors of Future | Louis Koo , Tang Wai But | One Cool Film Production Media Asia Film Production World Universe Culture iQiyi Motion Pictures (Beijing) Beijing Unimedia Television Culture Tianjin Maoyan Weying Media Shenzhen Film Studio Shanghai CMC Pictures Beijing Gutian Film and Television Production Shenzhen Film & Television Co. Beijing Le Art Media & Culture Co. Lok Tin Films Production",https://en.wikipedia.org/wiki/Hong_Kong_Film_Award_for_Best_Film
2046,Wai Ka-fai Jason Siu Elaine Chu,Emperor Film Production Beijing Super Lion Culture Communication,False,Detective vs Sleuths | Wai Ka-fai Jason Siu Elaine Chu | Emperor Film Production Beijing Super Lion Culture Communication,https://en.wikipedia.org/wiki/Hong_Kong_Film_Award_for_Best_Film
2046,Mani Man,mm2 Entertainment,False,The Narrow Road | Mani Man | mm2 Entertainment,https://en.wikipedia.org/wiki/Hong_Kong_Film_Award_for_Best_Film
2046,A Guilty Conscience,"Bill Kong , Ivy Ho",True,"2024 (42nd) | A Guilty Conscience | Bill Kong , Ivy Ho | Edko Films Alibaba Pictures The Film Development Fund Irresistible Beta Limited | [ 42 ]",https://en.wikipedia.org/wiki/Hong_Kong_Film_Award_for_Best_Film
2046,Philip Yung,One Cool Film Production Limited The Joseph Lau Luen Hung Charitable Trust,False,In Broad Daylight | Philip Yung | One Cool Film Production Limited The Joseph Lau Luen Hung Charitable Trust,https://en.wikipedia.org/wiki/Hong_Kong_Film_Award_for_Best_Film
2046,Derek Yee,Roundtable Pictures Limited,False,Time Still Turns the Pages | Derek Yee | Roundtable Pictures Limited,https://en.wikipedia.org/wiki/Hong_Kong_Film_Award_for_Best_Film
2046,Johnnie To Yau Nai Hoi Elaine Chu,MakerVille Company Limited Noble Castle Asia Limited,False,Mad Fate | Johnnie To Yau Nai Hoi Elaine Chu | MakerVille Company Limited Noble Castle Asia Limited,https://en.wikipedia.org/wiki/Hong_Kong_Film_Award_for_Best_Film
2046,Ronald Wong,Emperor Film Production Company Tianjin Maoyan Weying Cultural Media Company Xin Hui Ying Film Culture,False,The Goldfinger | Ronald Wong | Emperor Film Production Company Tianjin Maoyan Weying Cultural Media Company Xin Hui Ying Film Culture,https://en.wikipedia.org/wiki/Hong_Kong_Film_Award_for_Best_Film
2046,Twilight of the Warriors: Walled In,"John Chong , Wilson Yip",True,"2025 (43rd) | Twilight of the Warriors: Walled In | John Chong , Wilson Yip | Media Asia Films Entertaining Power One Cool Film Production Limited Sil-Metropole Organisation Lian Ray Pictures HG Entertainment | [ 43 ]",https://en.wikipedia.org/wiki/Hong_Kong_Film_Award_for_Best_Film
2046,Amy Chin,Word by Word The Film Development Fund of Hong Kong CCIDAHK Yan Ley Investment Limited Ling Ying Foundation,False,Papa | Amy Chin | Word by Word The Film Development Fund of Hong Kong CCIDAHK Yan Ley Investment Limited Ling Ying Foundation,https://en.wikipedia.org/wiki/Hong_Kong_Film_Award_for_Best_Film
2046,Adam Wong Jacqueline Liu Ho Hong,One Cool Film Production,False,The Way We Talk | Adam Wong Jacqueline Liu Ho Hong | One Cool Film Production,https://en.wikipedia.org/wiki/Hong_Kong_Film_Award_for_Best_Film
2046,Anselm Chan Jason Siu Chan Sing-yan,Emperor Motion Pictures Alibaba Pictures AMTD Digital,False,The Last Dance | Anselm Chan Jason Siu Chan Sing-yan | Emperor Motion Pictures Alibaba Pictures AMTD Digital,https://en.wikipedia.org/wiki/Hong_Kong_Film_Award_for_Best_Film
2046,Michael J. Werner Teresa Kwong Sandy Yip Chowee Leow Stan Guingon,New Voice Film Productions,False,All Shall Be Well | Michael J. Werner Teresa Kwong Sandy Yip Chowee Leow Stan Guingon | New Voice Film Productions,https://en.wikipedia.org/wiki/Hong_Kong_Film_Award_for_Best_Film
2046,Ciao UFO,"Amy Chin, Bonnie Wong",True,"2026 (44th) | Ciao UFO | Amy Chin, Bonnie Wong | Sun Pictures Icon Group | [ 44 ]",https://en.wikipedia.org/wiki/Hong_Kong_Film_Award_for_Best_Film
2046,Polly Yeung Chan Gin-kai,Point Five Productions Silver Media Group,False,Another World | Polly Yeung Chan Gin-kai | Point Five Productions Silver Media Group,https://en.wikipedia.org/wiki/Hong_Kong_Film_Award_for_Best_Film
2046,Juno Mak Catherine Hun,One Cool Film Production Sil-Metropole Organisation,False,Sons of the Neon Night | Juno Mak Catherine Hun | One Cool Film Production Sil-Metropole Organisation,https://en.wikipedia.org/wiki/Hong_Kong_Film_Award_for_Best_Film
2046,Louis Koo Tang Wai-but,One Cool Film Production,False,Back to the Past | Louis Koo Tang Wai-but | One Cool Film Production,https://en.wikipedia.org/wiki/Hong_Kong_Film_Award_for_Best_Film
2046,Peter Chan,Tianjin Maoyan Weiying Culture Media Huangxi Media China Film Group,False,She's Got No Name | Peter Chan | Tianjin Maoyan Weiying Culture Media Huangxi Media China Film Group,https://en.wikipedia.org/wiki/Hong_Kong_Film_Award_for_Best_Film
