year,film,person,is_winner,raw_text,source_url
,Father and Son,Wong Kai-chuen,True,1982 (1st) | Father and Son | Wong Kai-chuen | Phoenix Motion Picture Company | [ 1 ],https://en.wikipedia.org/wiki/Hong_Kong_Film_Award_for_Best_Film
,Boat People,Xia Meng,True,1983 (2nd) | Boat People | Xia Meng | Bluebird Film Company Greenworld Company | [ 2 ],https://en.wikipedia.org/wiki/Hong_Kong_Film_Award_for_Best_Film
,Johnny Mak Tong-hung,Pearl City Films,False,Lonely Fifteen | Johnny Mak Tong-hung | Pearl City Films,https://en.wikipedia.org/wiki/Hong_Kong_Film_Award_for_Best_Film
,Raymond Chow,Golden Harvest,False,The Prodigal Son | Raymond Chow | Golden Harvest,https://en.wikipedia.org/wiki/Hong_Kong_Film_Award_for_Best_Film
,Dennis Yu Jeffrey Lau,Century Motion Picture,False,Coolie Killer | Dennis Yu Jeffrey Lau | Century Motion Picture,https://en.wikipedia.org/wiki/Hong_Kong_Film_Award_for_Best_Film
,Jeffrey Lau Dennis Yu,Century Motion Picture,False,Nomad | Jeffrey Lau Dennis Yu | Century Motion Picture,https://en.wikipedia.org/wiki/Hong_Kong_Film_Award_for_Best_Film
,Ah Ying,,True,1984 (3rd) | Ah Ying |  |  | [ 3 ],https://en.wikipedia.org/wiki/Hong_Kong_Film_Award_for_Best_Film
,Homecoming,,True,1985 (4th) | Homecoming |  |  | [ 4 ],https://en.wikipedia.org/wiki/Hong_Kong_Film_Award_for_Best_Film
,Police Story,,True,1986 (5th) | Police Story |  |  | [ 5 ],https://en.wikipedia.org/wiki/Hong_Kong_Film_Award_for_Best_Film
,A Better Tomorrow,,True,1987 (6th) | A Better Tomorrow |  |  | [ 6 ],https://en.wikipedia.org/wiki/Hong_Kong_Film_Award_for_Best_Film
,An Autumn's Tale,,True,1988 (7th) | An Autumn's Tale |  |  | [ 7 ],https://en.wikipedia.org/wiki/Hong_Kong_Film_Award_for_Best_Film
,Ann Hui,,False,The Romance of Book & Sword | Ann Hui | ,https://en.wikipedia.org/wiki/Hong_Kong_Film_Award_for_Best_Film
,Rouge,,True,1989 (8th) | Rouge |  |  | [ 8 ],https://en.wikipedia.org/wiki/Hong_Kong_Film_Award_for_Best_Film
,Beyond the Sunset,,True,1990 (9th) | Beyond the Sunset |  |  | [ 9 ],https://en.wikipedia.org/wiki/Hong_Kong_Film_Award_for_Best_Film
,Days of Being Wild,Wong Kar-wai,True,1991 (10th) | Days of Being Wild | Wong Kar-wai |  | [ 10 ],https://en.wikipedia.org/wiki/Hong_Kong_Film_Award_for_Best_Film
,Ann Hui,,False,Song of the Exile | Ann Hui | ,https://en.wikipedia.org/wiki/Hong_Kong_Film_Award_for_Best_Film
,To Be Number One,,True,1992 (11th) | To Be Number One |  |  | [ 11 ],https://en.wikipedia.org/wiki/Hong_Kong_Film_Award_for_Best_Film
,Cageman,,True,1993 (12th) | Cageman |  |  | [ 12 ],https://en.wikipedia.org/wiki/Hong_Kong_Film_Award_for_Best_Film
,"C'est la vie, mon chéri",,True,"1994 (13th) | C'est la vie, mon chéri |  |  | [ 13 ]",https://en.wikipedia.org/wiki/Hong_Kong_Film_Award_for_Best_Film
,Chungking Express,Wong Kar-wai,True,1995 (14th) | Chungking Express | Wong Kar-wai |  | [ 14 ],https://en.wikipedia.org/wiki/Hong_Kong_Film_Award_for_Best_Film
,Wong Kar-wai,,False,Ashes of Time | Wong Kar-wai | ,https://en.wikipedia.org/wiki/Hong_Kong_Film_Award_for_Best_Film
,Summer Snow,Ann Hui,True,1996 (15th) | Summer Snow | Ann Hui |  | [ 15 ],https://en.wikipedia.org/wiki/Hong_Kong_Film_Award_for_Best_Film
,Wong Kar-wai,,False,Fallen Angels | Wong Kar-wai | ,https://en.wikipedia.org/wiki/Hong_Kong_Film_Award_for_Best_Film
,Comrades: Almost a Love Story,Peter Chan,True,1997 (16th) | Comrades: Almost a Love Story | Peter Chan |  | [ 16 ],https://en.wikipedia.org/wiki/Hong_Kong_Film_Award_for_Best_Film
,Made in Hong Kong,,True,1998 (17th) | Made in Hong Kong |  |  | [ 17 ],https://en.wikipedia.org/wiki/Hong_Kong_Film_Award_for_Best_Film
,Wong Kar-wai,,False,Happy Together | Wong Kar-wai | ,https://en.wikipedia.org/wiki/Hong_Kong_Film_Award_for_Best_Film
,Beast Cops,,True,1999 (18th) | Beast Cops |  |  | [ 18 ],https://en.wikipedia.org/wiki/Hong_Kong_Film_Award_for_Best_Film
,Ordinary Heroes,Ann Hui,True,2000 (19th) | Ordinary Heroes | Ann Hui | Class Limited | [ 19 ],https://en.wikipedia.org/wiki/Hong_Kong_Film_Award_for_Best_Film
,Doris Yang & Makoto Ueda,Nicetop Independent Ltd & NHK Japan Broadcasting Corporation,False,Little Cheung | Doris Yang & Makoto Ueda | Nicetop Independent Ltd & NHK Japan Broadcasting Corporation,https://en.wikipedia.org/wiki/Hong_Kong_Film_Award_for_Best_Film
,Johnnie To,Milkyway Image Ltd.,False,The Mission | Johnnie To | Milkyway Image (HK) Ltd.,https://en.wikipedia.org/wiki/Hong_Kong_Film_Award_for_Best_Film
,David Chan,"GH Pictures Ltd, Deltamac Company Limited & Sil-Metropole Organisation Limited",False,"Fly Me to Polaris | David Chan | GH Pictures (China) Ltd, Deltamac Company Limited & Sil-Metropole Organisation Limited",https://en.wikipedia.org/wiki/Hong_Kong_Film_Award_for_Best_Film
,Johnnie To,Win's Entertainment Ltd,False,Running Out of Time | Johnnie To | Win's Entertainment Ltd,https://en.wikipedia.org/wiki/Hong_Kong_Film_Award_for_Best_Film
,"Crouching Tiger, Hidden Dragon","Bill Kong, Hsu Li Kong & Ang Lee",True,"2001 (20th) | Crouching Tiger, Hidden Dragon | Bill Kong, Hsu Li Kong & Ang Lee | Columbia Pictures Film Production Asia & Good Machine International | [ 20 ]",https://en.wikipedia.org/wiki/Hong_Kong_Film_Award_for_Best_Film
,Wong Kar-wai,Block 2 Pictures Inc & Paradis Film,False,In the Mood for Love | Wong Kar-wai | Block 2 Pictures Inc & Paradis Film,https://en.wikipedia.org/wiki/Hong_Kong_Film_Award_for_Best_Film
,Doris Yang,Nicetop Independent Ltd,False,"Durian, Durian | Doris Yang | Nicetop Independent Ltd",https://en.wikipedia.org/wiki/Hong_Kong_Film_Award_for_Best_Film
,Johnnie To & Wai Ka-Fai,One Hundred Years of Film Co Ltd,False,Needing You... | Johnnie To & Wai Ka-Fai | One Hundred Years of Film Co Ltd,https://en.wikipedia.org/wiki/Hong_Kong_Film_Award_for_Best_Film
,Chan Hing Kai & Amy Chin,One Hundred Years of Film Co Ltd,False,Jiang hu: The Triad Zone | Chan Hing Kai & Amy Chin | One Hundred Years of Film Co Ltd,https://en.wikipedia.org/wiki/Hong_Kong_Film_Award_for_Best_Film
,Shaolin Soccer,Yeung Kwok Fai,True,2002 (21st) | Shaolin Soccer | Yeung Kwok Fai | The Star Overseas Ltd & Universe Entertainment Ltd | [ 21 ],https://en.wikipedia.org/wiki/Hong_Kong_Film_Award_for_Best_Film
,"Ann Hui , Derek Yee",Filmko Pictures Ltd,False,"July Rhapsody | Ann Hui , Derek Yee | Filmko Pictures Ltd",https://en.wikipedia.org/wiki/Hong_Kong_Film_Award_for_Best_Film
,"Zhang Yong Ning, Kwan Siu Wai",Omico International Management Co Ltd,False,"Lan Yu | Zhang Yong Ning, Kwan Siu Wai | Omico International Management Co Ltd",https://en.wikipedia.org/wiki/Hong_Kong_Film_Award_for_Best_Film
,Johnnie To & Wai Ka-Fai,One Hundred Years of Film Co Ltd,False,Love on a Diet | Johnnie To & Wai Ka-Fai | One Hundred Years of Film Co Ltd,https://en.wikipedia.org/wiki/Hong_Kong_Film_Award_for_Best_Film
,"John Chong, Solon So, Alex Law",Media Asia Films Ltd,False,"Beijing Rocks | John Chong, Solon So, Alex Law | Media Asia Films (BVI) Ltd",https://en.wikipedia.org/wiki/Hong_Kong_Film_Award_for_Best_Film
,Infernal Affairs,Andrew Lau,True,2003 (22nd) | Infernal Affairs | Andrew Lau | Media Asia Films Ltd | [ 22 ],https://en.wikipedia.org/wiki/Hong_Kong_Film_Award_for_Best_Film
,Peter Chan & Jo Jo Hui,Applause Pictures & Panorama Entertainment,False,Golden Chicken | Peter Chan & Jo Jo Hui | Applause Pictures & Panorama Entertainment,https://en.wikipedia.org/wiki/Hong_Kong_Film_Award_for_Best_Film
,Jo Jo Hui,Applause Pictures,False,Three: Going Home | Jo Jo Hui | Applause Pictures,https://en.wikipedia.org/wiki/Hong_Kong_Film_Award_for_Best_Film
,"Fruit Chan , Doris Yang, Kei Haruna & Sylvain Bursztejn",Nicetop Independent Ltd,False,"Hollywood Hong Kong | Fruit Chan ,  Doris Yang, Kei Haruna & Sylvain Bursztejn | Nicetop Independent Ltd",https://en.wikipedia.org/wiki/Hong_Kong_Film_Award_for_Best_Film
,"Zang Yimou , Bill Kong",Elite Group Enterprises Inc.,False,"Hero | Zang Yimou , Bill Kong | Elite Group Enterprises Inc.",https://en.wikipedia.org/wiki/Hong_Kong_Film_Award_for_Best_Film
,Running on Karma,Johnnie To & Wai Ka-Fai,True,2004 (23rd) | Running on Karma | Johnnie To & Wai Ka-Fai | One Hundred Years of Film Co Ltd | [ 23 ],https://en.wikipedia.org/wiki/Hong_Kong_Film_Award_for_Best_Film
,Johnnie To,Mei Ah Production Co Ltd,False,PTU | Johnnie To | Mei Ah Production Co Ltd,https://en.wikipedia.org/wiki/Hong_Kong_Film_Award_for_Best_Film
,Henri Fong Ping,One Hundred Years of Film Co Ltd & Sil-Metropole Organisation Ltd,False,Lost in Time | Henri Fong Ping | One Hundred Years of Film Co Ltd & Sil-Metropole Organisation Ltd,https://en.wikipedia.org/wiki/Hong_Kong_Film_Award_for_Best_Film
,Andrew Lau,"Media Asia Films Ltd, Raintree Pictures Pte Ltd & Eastern Dragon Film Co Ltd",False,"Infernal Affairs II | Andrew Lau | Media Asia Films Ltd, Raintree Pictures Pte Ltd & Eastern Dragon Film Co Ltd",https://en.wikipedia.org/wiki/Hong_Kong_Film_Award_for_Best_Film
,Andrew Lau & Gao Feng Jun,"Media Asia Films Ltd, Tianjin Film Studio, Eastern Dragon Film Co Ltd & CMC Group",False,"Infernal Affairs III | Andrew Lau & Gao Feng Jun | Media Asia Films Ltd, Tianjin Film Studio, Eastern Dragon Film Co Ltd & CMC Group",https://en.wikipedia.org/wiki/Hong_Kong_Film_Award_for_Best_Film
,Kung Fu Hustle,"Stephen Chow , Chui Po Chu, Jeffrey Lau , Han San Ping & Wang Zhong Lei",True,"2005 (24th) | Kung Fu Hustle | Stephen Chow , Chui Po Chu, Jeffrey Lau , Han San Ping & Wang Zhong Lei | Columbia Pictures Film Production Asia Ltd, Beijing Film Studio of China Film Group Corporation & Huayi Brothers & Taihe Film Investment Co Ltd | [ 24 ]",https://en.wikipedia.org/wiki/Hong_Kong_Film_Award_for_Best_Film
2046,Wong Kar-wai,"Block 2 Pictures, Paradis Films, Classic SRL, Orly Films & Shanghai Film Group Corporation",False,"2046 | Wong Kar-wai | Block 2 Pictures, Paradis Films, Classic SRL, Orly Films & Shanghai Film Group Corporation",https://en.wikipedia.org/wiki/Hong_Kong_Film_Award_for_Best_Film
2046,Henri Fong Ping,Universe Entertainment Ltd & Sil-Metropole Organisation Ltd,False,One Nite in Mongkok | Henri Fong Ping | Universe Entertainment Ltd & Sil-Metropole Organisation Ltd,https://en.wikipedia.org/wiki/Hong_Kong_Film_Award_for_Best_Film
2046,"Willie Chan, Solon So, Benny Chan Muk-Sing & Barbie Tung",JCE Movies Ltd & China Film Group Corporation,False,"New Police Story | Willie Chan, Solon So, Benny Chan Muk-Sing & Barbie Tung | JCE Movies Ltd & China Film Group Corporation",https://en.wikipedia.org/wiki/Hong_Kong_Film_Award_for_Best_Film
2046,Johnnie To & Cao Biao,Media Asia Films Ltd & China Film Group Corporation,False,Breaking News | Johnnie To & Cao Biao | Media Asia Films Ltd & China Film Group Corporation,https://en.wikipedia.org/wiki/Hong_Kong_Film_Award_for_Best_Film
2046,Election,"Johnnie To , Dennis Law Sau-Yiu",True,"2006 (25th) | Election | Johnnie To , Dennis Law Sau-Yiu | Milkyway Image (HK) Ltd & One Hundred Years Of Film Co Ltd | [ 25 ]",https://en.wikipedia.org/wiki/Hong_Kong_Film_Award_for_Best_Film
2046,"Willie Chan Chee Kheong, Solon So Che Hung & Barbie Tung Wun Sze",JCE Movies Ltd & China Film Group Corporation,False,"The Myth | Willie Chan Chee Kheong, Solon So Che Hung & Barbie Tung Wun Sze | JCE Movies Ltd & China Film Group Corporation",https://en.wikipedia.org/wiki/Hong_Kong_Film_Award_for_Best_Film
2046,Andrew Lau,Media Asia Films Ltd & Sil-Metropole Organisation Ltd,False,Initial D | Andrew Lau | Media Asia Films Ltd & Sil-Metropole Organisation Ltd,https://en.wikipedia.org/wiki/Hong_Kong_Film_Award_for_Best_Film
2046,Peter Chan & Andre Morgan,"Astro-Shaw, Television Broadcasts Ltd & Stellar Megamedia Group Ltd",False,"Perhaps Love | Peter Chan & Andre Morgan | Astro-Shaw, Television Broadcasts Ltd & Stellar Megamedia Group Ltd",https://en.wikipedia.org/wiki/Hong_Kong_Film_Award_for_Best_Film
2046,"Tsui Hark , Lee Joo Ick, Ma Zhong Jun & Pan Zhizhong","Beijing Ciwen Film & TV Production Co Ltd, Boram Entertainment Inc, City Glory Pictures Ltd",False,"Seven Swords | Tsui Hark , Lee Joo Ick, Ma Zhong Jun & Pan Zhizhong | Beijing Ciwen Film & TV Production Co Ltd, Boram Entertainment Inc, City Glory Pictures Ltd",https://en.wikipedia.org/wiki/Hong_Kong_Film_Award_for_Best_Film
2046,After This Our Exile,Chiu Li Kuang,True,"2007 (26th) | After This Our Exile | Chiu Li Kuang | Vision Film Workshop, Black & White Films Ltd | [ 26 ]",https://en.wikipedia.org/wiki/Hong_Kong_Film_Award_for_Best_Film
2046,"Bill Kong, Ronny Yu, Jet Li , Yang Buting",Hero China International Ltd & China Film Group Corporation Beijing Film Studio,False,"Fearless | Bill Kong, Ronny Yu, Jet Li , Yang Buting | Hero China International Ltd & China Film Group Corporation Beijing Film Studio",https://en.wikipedia.org/wiki/Hong_Kong_Film_Award_for_Best_Film
2046,"Johnnie To , Dennis Law Sau-Yiu",One Hundred Years Of Film Co Ltd & Milkyway Image Ltd,False,"Election 2 | Johnnie To , Dennis Law Sau-Yiu | One Hundred Years Of Film Co Ltd & Milkyway Image (HK) Ltd",https://en.wikipedia.org/wiki/Hong_Kong_Film_Award_for_Best_Film
2046,Johnnie To,Media Asia Films Ltd,False,Exiled | Johnnie To | Media Asia Films Ltd,https://en.wikipedia.org/wiki/Hong_Kong_Film_Award_for_Best_Film
2046,"Bill Kong, Zhang Weiping","Film Partner International Inc, Edko Films Ltd & Beijing New Picture Film Co Ltd",False,"Curse of the Golden Flower | Bill Kong, Zhang Weiping | Film Partner International Inc, Edko Films Ltd & Beijing New Picture Film Co Ltd",https://en.wikipedia.org/wiki/Hong_Kong_Film_Award_for_Best_Film
2046,The Warlords,"Peter Chan , Andre Morgan, Huang Jian Xin",True,"2008 (27th) | The Warlords | Peter Chan , Andre Morgan, Huang Jian Xin | Media Asia Films Ltd, Morgan & Chan Films Ltd & China Film Group Corporation | [ 27 ]",https://en.wikipedia.org/wiki/Hong_Kong_Film_Award_for_Best_Film
2046,"Yuan Mei, Yu Dong & Cui Yong","Class Ltd, Cheerland Entertainment Organization & Beijing Polybona Film Distribution Co Ltd",False,"The Postmodern Life of My Aunt | Yuan Mei, Yu Dong & Cui Yong | Class Ltd, Cheerland Entertainment Organization & Beijing Polybona Film Distribution Co Ltd",https://en.wikipedia.org/wiki/Hong_Kong_Film_Award_for_Best_Film
2046,"Johnnie To , Tsui Siu Ming",Sundream Motion Pictures Ltd,False,"Eye in the Sky | Johnnie To , Tsui Siu Ming | Sundream Motion Pictures Ltd",https://en.wikipedia.org/wiki/Hong_Kong_Film_Award_for_Best_Film
2046,Johnnie To & Wai Ka-Fai,One Hundred Years Of Films Co Ltd,False,Mad Detective | Johnnie To & Wai Ka-Fai | One Hundred Years Of Films Co Ltd,https://en.wikipedia.org/wiki/Hong_Kong_Film_Award_for_Best_Film
2046,Peter Chan,"Artforce International Ltd, MediaCorp Raintree Pictures, Global Entertainment Group Ltd, China Film Group Corporation & Polybona Film Distribution Co Ltd",False,"Protégé | Peter Chan | Artforce International Ltd, MediaCorp Raintree Pictures, Global Entertainment Group (Asia) Ltd, China Film Group Corporation & Polybona Film Distribution Co Ltd",https://en.wikipedia.org/wiki/Hong_Kong_Film_Award_for_Best_Film
2046,Ip Man,Raymond Wong,True,2009 (28th) | Ip Man | Raymond Wong | Mandarin Films Distribution Co Ltd | [ 28 ],https://en.wikipedia.org/wiki/Hong_Kong_Film_Award_for_Best_Film
2046,"Stephen Chow , Chui Po Chu, Han San Ping, Vincent Kok, Shi Dong Ming, Connie Wong","Columbia Pictures Film Production Asia Ltd, Star Overseas,Beijing Film Studio of China Film Group Corporation",False,"CJ7 | Stephen Chow , Chui Po Chu, Han San Ping, Vincent Kok, Shi Dong Ming, Connie Wong | Columbia Pictures Film Production Asia Ltd, Star Overseas,Beijing Film Studio of China Film Group Corporation",https://en.wikipedia.org/wiki/Hong_Kong_Film_Award_for_Best_Film
2046,"John Woo , Terence Chang","China Film Group Corporation, Avex Entertainment Inc., CMC Entertainment, Showbox, Lion Rock Productions, Chengtian Entertainment International Holdings Ltd",False,"Red Cliff | John Woo , Terence Chang | China Film Group Corporation, Avex Entertainment Inc., CMC Entertainment, Showbox, Lion Rock Productions, Chengtian Entertainment International Holdings Ltd",https://en.wikipedia.org/wiki/Hong_Kong_Film_Award_for_Best_Film
2046,Gordon Chan,"Golden Sun Films Holdings Ltd, MediaCorp Raintree Pictures Pte Ltd, NingXia Film Studio, Shanghai Film Group Corporation",False,"Painted Skin | Gordon Chan | Golden Sun Films Holdings Ltd, MediaCorp Raintree Pictures Pte Ltd, NingXia Film Studio, Shanghai Film Group Corporation",https://en.wikipedia.org/wiki/Hong_Kong_Film_Award_for_Best_Film
2046,"Ann Hui , Wong Yat Ping",Mega-Vision Pictures Ltd,False,"The Way We Are | Ann Hui , Wong Yat Ping | Mega-Vision Pictures Ltd",https://en.wikipedia.org/wiki/Hong_Kong_Film_Award_for_Best_Film
2046,Bodyguards and Assassins,Peter Chan,True,2010 (29th) | Bodyguards and Assassins | Peter Chan |  | [ 29 ],https://en.wikipedia.org/wiki/Hong_Kong_Film_Award_for_Best_Film
2046,Cheung King Wai,,False,KJ: Music and Life | Cheung King Wai | ,https://en.wikipedia.org/wiki/Hong_Kong_Film_Award_for_Best_Film
2046,"Alan Mak , Felix Chong",,False,"Overheard | Alan Mak , Felix Chong | ",https://en.wikipedia.org/wiki/Hong_Kong_Film_Award_for_Best_Film
2046,John Woo,,False,Red Cliff II | John Woo | ,https://en.wikipedia.org/wiki/Hong_Kong_Film_Award_for_Best_Film
2046,Derek Yee,,False,Shinjuku Incident | Derek Yee | ,https://en.wikipedia.org/wiki/Hong_Kong_Film_Award_for_Best_Film
2046,Gallants,Gordon Lam,True,2011 (30th) | Gallants | Gordon Lam |  | [ 30 ],https://en.wikipedia.org/wiki/Hong_Kong_Film_Award_for_Best_Film
2046,"Tsui Hark , Nansun Shi and Peggy Lee",,False,"Detective Dee and the Mystery of the Phantom Flame | Tsui Hark , Nansun Shi and Peggy Lee | ",https://en.wikipedia.org/wiki/Hong_Kong_Film_Award_for_Best_Film
2046,Raymond Wong,,False,Ip Man 2 | Raymond Wong | ,https://en.wikipedia.org/wiki/Hong_Kong_Film_Award_for_Best_Film
2046,"John Woo , Terence Chang , Ivy Zhong, Tina Shi and Lorraine Hoh",,False,"Reign of Assassins | John Woo , Terence Chang , Ivy Zhong, Tina Shi and Lorraine Hoh | ",https://en.wikipedia.org/wiki/Hong_Kong_Film_Award_for_Best_Film
2046,"Albert Lee, Wang Zhonglei and Cheung Hong-tat",,False,"The Stool Pigeon | Albert Lee, Wang Zhonglei and Cheung Hong-tat | ",https://en.wikipedia.org/wiki/Hong_Kong_Film_Award_for_Best_Film
2046,A Simple Life,"Roger Lee, Ann Hui and Chan Pui Wah",True,"2012 (31st) | A Simple Life | Roger Lee, Ann Hui and Chan Pui Wah |  | [ 31 ]",https://en.wikipedia.org/wiki/Hong_Kong_Film_Award_for_Best_Film
2046,Johnnie To,,False,Life Without Principle | Johnnie To | ,https://en.wikipedia.org/wiki/Hong_Kong_Film_Award_for_Best_Film
2046,Tsui Hark,,False,Flying Swords of Dragon Gate | Tsui Hark | ,https://en.wikipedia.org/wiki/Hong_Kong_Film_Award_for_Best_Film
2046,Derek Yee,,False,Overheard 2 | Derek Yee | ,https://en.wikipedia.org/wiki/Hong_Kong_Film_Award_for_Best_Film
2046,"Ma Ke, Albert Lee, Yin Homber, Barbie Tung & Zhao Haicheng",,False,"Let the Bullets Fly | Ma Ke, Albert Lee, Yin Homber, Barbie Tung & Zhao Haicheng | ",https://en.wikipedia.org/wiki/Hong_Kong_Film_Award_for_Best_Film
2046,Cold War,"Bill Kong, Mathew Tang & Ivy Ho",True,"2013 (32nd) | Cold War | Bill Kong, Mathew Tang & Ivy Ho |  | [ 32 ]",https://en.wikipedia.org/wiki/Hong_Kong_Film_Award_for_Best_Film
2046,Pang Ho-cheung & Subi Liang,,False,Vulgaria | Pang Ho-cheung & Subi Liang | ,https://en.wikipedia.org/wiki/Hong_Kong_Film_Award_for_Best_Film
2046,Johnnie To,,False,Motorway | Johnnie To | ,https://en.wikipedia.org/wiki/Hong_Kong_Film_Award_for_Best_Film
2046,"Derek Yee , Mandy Law, Zhang Zhao & Albert Lee",,False,"The Bullet Vanishes | Derek Yee , Mandy Law, Zhang Zhao & Albert Lee | ",https://en.wikipedia.org/wiki/Hong_Kong_Film_Award_for_Best_Film
2046,Candy Leung,,False,The Viral Factor | Candy Leung | ,https://en.wikipedia.org/wiki/Hong_Kong_Film_Award_for_Best_Film
2046,The Grandmaster,"Ng See-yuen, Megan Ellison & Wong Kar-wai",True,"2014 (33rd) | The Grandmaster | Ng See-yuen, Megan Ellison & Wong Kar-wai |  | [ 33 ]",https://en.wikipedia.org/wiki/Hong_Kong_Film_Award_for_Best_Film
2046,Stephen Chow & Wang Zhonglei,,False,Journey to the West: Conquering the Demons | Stephen Chow & Wang Zhonglei | ,https://en.wikipedia.org/wiki/Hong_Kong_Film_Award_for_Best_Film
2046,Candy Leung,,False,Unbeatable | Candy Leung | ,https://en.wikipedia.org/wiki/Hong_Kong_Film_Award_for_Best_Film
2046,Saville Chan & Roddy Wong,,False,The Way We Dance | Saville Chan & Roddy Wong | ,https://en.wikipedia.org/wiki/Hong_Kong_Film_Award_for_Best_Film
2046,Benny Chan,,False,The White Storm | Benny Chan | ,https://en.wikipedia.org/wiki/Hong_Kong_Film_Award_for_Best_Film
2046,The Golden Era,Qin Hong,True,2015 (34th) | The Golden Era | Qin Hong |  | [ 34 ],https://en.wikipedia.org/wiki/Hong_Kong_Film_Award_for_Best_Film
2046,Peter Chan & Hui Yuet-chun,,False,Dearest | Peter Chan & Hui Yuet-chun | ,https://en.wikipedia.org/wiki/Hong_Kong_Film_Award_for_Best_Film
2046,Derek Yee & Ronald Wong,,False,Overheard 3 | Derek Yee & Ronald Wong | ,https://en.wikipedia.org/wiki/Hong_Kong_Film_Award_for_Best_Film
2046,Amy Chin,,False,The Midnight After | Amy Chin | ,https://en.wikipedia.org/wiki/Hong_Kong_Film_Award_for_Best_Film
2046,"Kuo-fu Chen, Subi Liang, Ho-Cheung Pang & Zhonglei Wang",,False,"Aberdeen | Kuo-fu Chen, Subi Liang, Ho-Cheung Pang & Zhonglei Wang | ",https://en.wikipedia.org/wiki/Hong_Kong_Film_Award_for_Best_Film
2046,Ten Years,Andrew Choi & Ng Ka Leung,True,2016 (35th) | Ten Years | Andrew Choi & Ng Ka Leung | Ten Years Studio Ltd | [ 35 ],https://en.wikipedia.org/wiki/Hong_Kong_Film_Award_for_Best_Film
2046,"Benny Chan Muk Shing , Alvin Lam Siu Keung, Stanley Tong Man Hong","Universe Entertainment Ltd, Sil-Metropole Organisation Ltd, Sun Entertainment Culture Ltd, One Cool Film Production Ltd, Beijing Monster Pictures Co Ltd, Yunnan Parashorea Cathayensis Culture Communication Co Ltd, Yinming Culture Communication Co Ltd, Foshan Join Media Group Co Ltd",False,"Little Big Master | Benny Chan Muk Shing , Alvin Lam Siu Keung, Stanley Tong Man Hong | Universe Entertainment Ltd, Sil-Metropole Organisation Ltd, Sun Entertainment Culture Ltd, One Cool Film Production Ltd, Beijing Monster Pictures Co Ltd, Yunnan Parashorea Cathayensis Culture Communication Co Ltd, Yinming Culture Communication Co Ltd, Foshan Join Media Group Co Ltd",https://en.wikipedia.org/wiki/Hong_Kong_Film_Award_for_Best_Film
2046,Huang Jianxin,"Bona Film Group Co Ltd, Huaxia Film Distribution Co Ltd, August First Film Studio, Wanda Media Co Ltd, China Movie Channel, Youku Tudou Film Inc, Shanghai Real Thing Media Co Ltd, Dream Sky Film Co Ltd, Bona Entertainment Co Ltd",False,"The Taking of Tiger Mountain | Huang Jianxin | Bona Film Group Co Ltd, Huaxia Film Distribution Co Ltd, August First Film Studio, Wanda Media Co Ltd, China Movie Channel, Youku Tudou Film Inc, Shanghai Real Thing Media Co Ltd, Dream Sky Film Co Ltd, Bona Entertainment Co Ltd",https://en.wikipedia.org/wiki/Hong_Kong_Film_Award_for_Best_Film
2046,Raymond Wong,"Pegasus Motion Pictures Ltd, Dreams Salon Entertainment Culture Ltd, Starbright Communications Ltd, My Pictures Studio",False,"Ip Man 3 | Raymond Wong | Pegasus Motion Pictures (HK) Ltd, Dreams Salon Entertainment Culture Ltd, Starbright Communications Ltd, My Pictures Studio",https://en.wikipedia.org/wiki/Hong_Kong_Film_Award_for_Best_Film
2046,"Julia Chu, Esther Koo, Kingman Cho","Mei Ah Film Production Co Ltd, Mei Ah Entertainment Development Inc",False,"Port of Call | Julia Chu, Esther Koo, Kingman Cho | Mei Ah Film Production Co Ltd, Mei Ah Entertainment Development Inc",https://en.wikipedia.org/wiki/Hong_Kong_Film_Award_for_Best_Film
2046,Trivisa,Johnnie To & Yau Nai-hoi,True,2017 (36th) | Trivisa | Johnnie To & Yau Nai-hoi | Media Asia Film Production Ltd & Beijing Hairun Pictures Co Ltd | [ 36 ],https://en.wikipedia.org/wiki/Hong_Kong_Film_Award_for_Best_Film
2046,"Peter Chan , Jojo Hui","We Pictures Ltd, JOYCORE Pictures Co Ltd, J.Q. Pictures Ltd, Alibaba Pictures Group Ltd, Huoerguosi Jiamei Pictures Co Ltd, Sky Grant Entertainment Ltd, JOYCORE Communication Co Ltd, Shanghai SMG Pictures Co Ltd, Applause Media Ltd",False,"Soul Mate | Peter Chan , Jojo Hui | We Pictures Ltd, JOYCORE Pictures (Shanghai) Co Ltd, J.Q. Pictures Ltd, Alibaba Pictures Group Ltd, Huoerguosi Jiamei Pictures Co Ltd, Sky Grant Entertainment Ltd, JOYCORE Communication Co Ltd, Shanghai SMG Pictures Co Ltd, Applause Media (Beijing) Ltd",https://en.wikipedia.org/wiki/Hong_Kong_Film_Award_for_Best_Film
2046,"Stephen Chow , Y. Y. Kong","The Star Overseas Ltd, Alpha Pictures Ltd, China Film Co Ltd, Hehe Film Corporation Ltd, Shannan Enlight Pictures Co Ltd, Shanghai New Culture Media Group Co Ltd, Shanghai Tianshi Culture Communication Co Ltd, China Cultural and Entertainment Fund L.P., Xiangshan Ze Yue Culture Media Co Ltd",False,"The Mermaid | Stephen Chow , Y. Y. Kong | The Star Overseas Ltd, Alpha Pictures (Hong Kong) Ltd, China Film Co Ltd, Hehe (Shanghai) Film Corporation Ltd, Shannan Enlight Pictures Co Ltd, Shanghai New Culture Media Group Co Ltd, Shanghai Tianshi Culture Communication Co Ltd, China Cultural and Entertainment Fund L.P., Xiangshan Ze Yue Culture Media Co Ltd",https://en.wikipedia.org/wiki/Hong_Kong_Film_Award_for_Best_Film
2046,"Bill Kong , Ivy Ho , Jiang Ping","Edko Films Ltd, Irresistible Beta Ltd, Edko Films Ltd, Tencent Penguin Pictures Co Ltd, China Film Co Ltd",False,"Cold War 2 | Bill Kong , Ivy Ho , Jiang Ping | Edko Films Ltd, Irresistible Beta Ltd, Edko (Beijing) Films Ltd, Tencent Penguin Pictures (Shanghai) Co Ltd, China Film Co Ltd",https://en.wikipedia.org/wiki/Hong_Kong_Film_Award_for_Best_Film
2046,"Chan Hing-kai, O Sing-pui",Flash Glory Ltd,False,"Weeds on Fire | Chan Hing-kai, O Sing-pui | Flash Glory Ltd",https://en.wikipedia.org/wiki/Hong_Kong_Film_Award_for_Best_Film
